{
  "$schema": "https://json-schema.org/draft/2020-12/schema",
  "$id": "schemas/adapter-manifest.schema.json",
  "title": "Qyrenith Adapter Manifest",
  "type": "object",
  "required": [
    "schema",
    "name",
    "version",
    "capabilities",
    "task_types",
    "risk_profile",
    "evidence_requirements",
    "command"
  ],
  "properties": {
    "schema": {
      "const": 1
    },
    "name": {
      "type": "string",
      "minLength": 1
    },
    "version": {
      "type": "string",
      "minLength": 1
    },
    "kind": {
      "type": "string"
    },
    "command": {
      "type": "array",
      "minItems": 1,
      "items": {
        "type": "string",
        "minLength": 1
      }
    },
    "capabilities": {
      "type": "array",
      "items": {
        "type": "string",
        "minLength": 1
      }
    },
    "supported_loaders": {
      "type": "array",
      "items": {
        "type": "string",
        "minLength": 1
      }
    },
    "supported_minecraft_versions": {
      "type": "array",
      "items": {
        "type": "string",
        "minLength": 1
      }
    },
    "task_types": {
      "type": "array",
      "items": {
        "type": "string",
        "minLength": 1
      }
    },
    "risk_profile": {
      "type": "string",
      "minLength": 1
    },
    "evidence_requirements": {
      "type": "array",
      "items": {
        "type": "string",
        "minLength": 1
      }
    },
    "trust": {
      "enum": [
        "VERIFIED",
        "COMMUNITY",
        "UNKNOWN"
      ]
    },
    "sha256": {
      "type": "string",
      "pattern": "^[A-Fa-f0-9]{64}$"
    },
    "entrypoint": {
      "type": "array",
      "items": {
        "type": "string"
      }
    },
    "supported_platforms": {
      "type": "array",
      "items": {
        "type": "string",
        "minLength": 1
      }
    },
    "supported_versions": {
      "type": "array",
      "items": {
        "type": "string",
        "minLength": 1
      }
    }
  },
  "additionalProperties": true,
  "anyOf": [
    {
      "required": [
        "supported_loaders",
        "supported_minecraft_versions"
      ]
    },
    {
      "required": [
        "supported_platforms",
        "supported_versions"
      ]
    }
  ]
}
